{
  "$schema": "../../../schemas/dataset-release.schema.json",
  "dataset_release_id": "paired-off-effect-smoke",
  "name": "paired-off-effect-smoke",
  "description": "实验 1 效果小样本：必须改仓库才能过的 3 题（无插件）。不要和校准 14 题混跑。",
  "case_revisions": [
    {
      "case_id": "paired-task-157",
      "case_revision_id": "paired-task-157.r1.off",
      "content_hash": "1ba03fb41c82725ad6514bd1eb88bd8eaa9118265142a1b8bb0328474f9b30b6"
    },
    {
      "case_id": "paired-task-158",
      "case_revision_id": "paired-task-158.r1.off",
      "content_hash": "091ab06393e9960d2e61c1173fa179d522f5ab90fc6ea6a70f1f367886de4722"
    },
    {
      "case_id": "paired-task-159",
      "case_revision_id": "paired-task-159.r1.off",
      "content_hash": "74685e2b23e8614d97defda0196ba3610a7c12d7cf04b19f699b4f00d0f8ceb8"
    }
  ],
  "closure_hash": "a68fac1bbdf4810afe5dcea4fa076f8244e153197632851ec9311213ca255080"
}
